{
  "schema_version": "0.1.0",
  "id": "legal-research-cn",
  "title": "中国法法律研究 Bundle",
  "description": "中国法律研究 skill 集群——通过元典 MCP（法规 / 案例 / 企业）+ Tavily MCP（二手文献）做精确法条检索、综合法律研究、裁判文书检索和企业信息查询。四个 skill 形成「按需精细查 + 综合研究备忘录」的研究闭环，可被 commercial / privacy / regulatory / employment 四大业务 cluster 在需要中国法 grounding 时调用。",
  "practice_area": "legal-research-cn",
  "version": "0.1.0",
  "status": "draft",
  "skills": [
    "prc-legal-research-law-search",
    "prc-legal-research-deep-research",
    "prc-legal-research-case-search",
    "prc-legal-research-company-search"
  ],
  "required_profiles": [],
  "recommended_capabilities": [
    "legal_research.search_laws",
    "legal_research.fetch_law",
    "legal_research.search_cases",
    "legal_research.fetch_case",
    "company_data.search_enterprise",
    "company_data.fetch_aggregation",
    "company_data.fetch_writ_list",
    "company_data.fetch_risk_signals",
    "web_research.search_secondary_sources",
    "artifact.write_file"
  ],
  "minimum_capabilities": [
    "legal_research.search_laws"
  ],
  "offline_capable": false,
  "minimum_review_level": "non_lawyer_with_attorney_access",
  "entry_skill": "prc-legal-research-deep-research",
  "setup_skill": null,
  "notes": [
    "Cluster 入口：`prc-legal-research-deep-research`——综合研究 + 8 阶段工作流（含**第二阶段硬性暂停**等待用户确认研究问题）。其他三个 skill 是单点工具：law-search（精确法条）/ case-search（裁判文书）/ company-search（企业信息）。",
    "**仅中国大陆法适用**。美国法等非中国大陆法事项请走当地商业法律研究服务（Westlaw / LexisNexis / CoCounsel 等）或当地律所；港澳台不在元典覆盖范围。",
    "MCP 连接器探测纪律：严禁仅凭 .mcp.json 声明就认为连接器可用——必须实际探测一次轻量级 capability 成功后才往下走。失败标 [连接器未核验] 并停止，不允许用模型知识模拟。",
    "来源标签三级分级：`[settled - 元典法规 YYYY-MM-DD 确认]` / `[元典法规]` / `[元典案例]` / `[元典企业数据]` / `[verify - 需对照原文]` / `[模型知识 — 需核验]`。所有来自 MCP 实际返回的引用按对应 vendor 标签；未经 MCP 核验的内容标 model-knowledge。",
    "deep-research 第二阶段硬性暂停：研究问题列出后未收到用户明确确认前禁止任何检索（含 Tavily 与元典 MCP）。",
    "case-search 分层检索顺序：权威案例（qwal）→ 普通案例（ptal）→ 语义检索（vector），不允许反序（除非用户明确不需要权威案例）。",
    "company-search 统计 vs 明细纪律：'有多少' / '风险摸排' 用 aggregation；'列出案件' / '具体案号' 用 writList / 专项接口；不混用。多家命中必须由用户消歧。",
    "工作成果头部按角色 + 法域：律师 + 中国法用'保密 / 内部法律分析'；非律师用'研究笔记 / 内部记录'；外发去头。中国法域不自动套用 attorney work product（这是美国 doctrine）。",
    "非律师 attorney-confirmation 门：用户基于研究结果做具体决策（出具法律意见 / 监管提交 / 诉讼起草 / 客户回函）前必须显式确认与律师复核。",
    "交接路径：研究完成后按问题归属移交对应业务 cluster——commercial（合同）/ privacy（隐私）/ regulatory（监管）/ employment（用工）。跨境业务的非中国大陆法部分由用户走当地商业法律研究服务或当地律所，本 skillpack 不覆盖。"
  ]
}
